codigo,cirugia,rvu,especialidad,grupo
54430,CORPORA CAVERNOSA-CORPUS SPONGIOSUM SHUNT,7,Sin clasificación,Sin clasificación
54435,CORPORA CAVERNOSA-GLANS PENIS FISTULIZ-PRIADISM,3.9,Sin clasificación,Sin clasificación
54440,PLASTIC OR PENIS INJURY,BR,Sin clasificación,Sin clasificación
54450,FORESKIN MANIP INCL LYSIS PREPUTIAL ADHESIONS,0.6,Sin clasificación,Sin clasificación
54500,BX TESTIS NEEDLE (SEPART PROC),0.6,Sin clasificación,Sin clasificación
54505,BX TESTIS INCS (SEPART PROC),1.8,Sin clasificación,Sin clasificación
54510,EXC LOCAL LES TESTIS,2.9,Sin clasificación,Sin clasificación
54520,ORCHIECTOMY SIMPL W/WO TESTICULAR PROSTH,3.5,Sin clasificación,Sin clasificación
54530,ORCHIECTOMY RADICAL TUMOR; ING APPROACH,5.3,Sin clasificación,Sin clasificación
54535,ORCHIECTOMY RADICAL TUMOR; W/ABD EXPLOR,5.6,Sin clasificación,Sin clasificación
54550,EXPLOR UNDESCENDED TESTIS,3.9,Sin clasificación,Sin clasificación
54560,EXPLOR UNDESCENDED TESTIS W/ABD EXPLOR,5.6,Sin clasificación,Sin clasificación
54600,REDUCTION TORSION TESTIS-SURG W/WO FIX CONTRALAT,4.7,Sin clasificación,Sin clasificación
54620,FIXA CONTRALATERAL TESTIS (SEPART PROC),2.3,Sin clasificación,Sin clasificación
54640,ORCHIOPEXY ANY TYPE W/WO HERNIA REPR,5.4,Sin clasificación,Sin clasificación
54645,ORCHIOPEXY W/WO HERNIA REPR SECOND STAGE,2.6,Sin clasificación,Sin clasificación
54660,INSRT TESTICULAR PROSTH (SEPART PROC),2.3,Sin clasificación,Sin clasificación
54670,SUTURE/REPR TESTICULAR INJURY,4.7,Sin clasificación,Sin clasificación
54680,TRANSPL TESTIS TO THIGH,5.8,Sin clasificación,Sin clasificación
54700,I&D EPIDIDYMIS TESTIS &/OR SCROTAL SPACE,1.1,Sin clasificación,Sin clasificación
54800,BX EPIDIDYMIS NEEDLE,0.6,Sin clasificación,Sin clasificación
54820,EXPLOR EPIDIDYMIS W/WO BX,2.4,Sin clasificación,Sin clasificación
54830,EXC LOCAL LES EPIDIDYMIS,2.5,Sin clasificación,Sin clasificación
54840,EXC SPERMATOCELE W/WO EPIDIDYMECTOMY,3.7,Sin clasificación,Sin clasificación
54860,EPIDIDYMECTOMY; UNILAT,3.9,Sin clasificación,Sin clasificación
54861,EPIDIDYMECTOMY; BILAT,5.8,Sin clasificación,Sin clasificación
54900,EPIDIDYMOVASOSTOMY ANASTOM EPIDIDY-VAS; UNILAT,5.8,Sin clasificación,Sin clasificación
54901,EPIDIDYMOVASOSTOMY ANASTOM EPIDIDY-VAS; BILAT,8,Sin clasificación,Sin clasificación
55000,PUNCT ASPIRAT HYDROCELE TUNICA VAG W/WO INJ MEDS,0.5,Sin clasificación,Sin clasificación
55040,EXC HYDROCELE; UNILAT,3.9,Sin clasificación,Sin clasificación
55041,EXC HYDROCELE; BILAT,6.1,Sin clasificación,Sin clasificación
55060,REPR TUNICA VAG HYDROCELE,2.9,Sin clasificación,Sin clasificación
55100,DRAINAGE SCROTAL WALL ABSCESS,0.4,Sin clasificación,Sin clasificación
55110,SCROTAL EXPLOR,2.9,Sin clasificación,Sin clasificación
55120,REMOV F B SCROTUM,1.3,Sin clasificación,Sin clasificación
55150,RESECT SCROTUM,4.9,Sin clasificación,Sin clasificación
55175,SCROTOPLASTY; SIMPL,3.9,Sin clasificación,Sin clasificación
55180,SCROTOPLASTY; COMPLIC,5.9,Sin clasificación,Sin clasificación
55200,VASOTOMY CANNULIZ W/WO INCS VAS (SEPART PROC),2.1,Sin clasificación,Sin clasificación
55250,VASECTOMY UNILAT/BILAT (SEP PRO) W/POSTOP SEMEN,2.1,Sin clasificación,Sin clasificación
55300,VASOTOMY-VASOGMS/SEMINAL VESICULOGMS UNI/BILAT,2.1,Sin clasificación,Sin clasificación
55400,VASOVASOSTOMY VASOVASORRHAPHY,8.3,Sin clasificación,Sin clasificación
55450,LIG VAS DEFERENS UNI/BILAT (SEPART PROC),1.4,Sin clasificación,Sin clasificación
55500,EXC HYDROCELE SPERMATIC CORD UNILAT (SEP PRO),2.9,Sin clasificación,Sin clasificación
55520,EXC LES SPERMATIC CORD (SEPART PROC),2.9,Sin clasificación,Sin clasificación
55530,EXC VARICOCELE/LIG SPERMATC VEINS; (SEPART PROC),4.7,Sin clasificación,Sin clasificación
55535,EXC VARICOCELE/LIG SPERMATIC VEINS; ABD APPROACH,5.5,Sin clasificación,Sin clasificación
55540,EXC VARICOCELE/LIG SPERMATC VEINS; W/HERNIA REPR,5.5,Sin clasificación,Sin clasificación
55600,VESICULOTOMY,3.9,Sin clasificación,Sin clasificación
55605,VESICULOTOMY; COMPLIC,6.4,Sin clasificación,Sin clasificación
55650,VESICULECTOMY ANY APPROACH,9.8,Sin clasificación,Sin clasificación
55680,EXC MULLERIAN DUCT CYST,2.9,Sin clasificación,Sin clasificación
55700,BX PROSTATE; NEEDLE/PUNCH SNGL/MX ANY APPROACH,1.2,Sin clasificación,Sin clasificación
55705,BX PROSTATE; INCS ANY APPROACH,4.7,Sin clasificación,Sin clasificación
55720,PROSTATOMY EXT DRAIN PROSTATIC ABSCESS; SIMPL,4.7,Sin clasificación,Sin clasificación
55725,PROSTATOMY EXT DRAIN PROSTATIC ABSCESS; COMPLIC,8,Sin clasificación,Sin clasificación
55801,PROSTATECTOMY PERINEAL SUBTL,8.8,Sin clasificación,Sin clasificación
55810,PROSTATECTOMY PERINEAL RADICAL,12.7,Sin clasificación,Sin clasificación
55812,PROSTATECTOMY PERINEAL RAD; W/LYMPH NODE BX,15.2,Sin clasificación,Sin clasificación
55815,PROSTATECTOMY PERINEAL; W/BILAT PELVIC LYMPHADEN,18.1,Sin clasificación,Sin clasificación
55821,PROSTATECTOMY; SUPRAPUBIC SUBTL 1/2 STAGES,9.8,Sin clasificación,Sin clasificación
55831,PROSTATECTOMY; RETROPUBIC SUBTL,9.8,Sin clasificación,Sin clasificación
55840,PROSTATECTOMY RETROPUBIC RADICAL,12.7,Sin clasificación,Sin clasificación
55842,PROSTATECTOMY RETROPUBIC RAD; W/LYMPH NODE BX,12.7,Sin clasificación,Sin clasificación
55845,PROSTATECTOMY RETROPUBIC RAD; W/BILAT LYMPHADEN,16.7,Sin clasificación,Sin clasificación
55860,EXPOSURE PROSTATE-INSRT RADIOACTIVE SUBSTANCE,3.9,Sin clasificación,Sin clasificación
55862,EXPOS PROSTATE-INSRT RADIOACT; W/LYMPH NODE BX,6.7,Sin clasificación,Sin clasificación
55865,EXPOSURE PROSTATE-INSRT RADIOACT; W/BILAT LYMPH,11.8,Sin clasificación,Sin clasificación
55870,ELECTROEJACULATION,BR,Sin clasificación,Sin clasificación
55899,UNLISTED PROC MALE GENIT SYST,BR,Sin clasificación,Sin clasificación
55970,INTERSEX SURG; MALE TO FE,RNE,Sin clasificación,Sin clasificación